[
 {
  "id": "2026-10-20-english-league-one-eng-stevenage-plymouth-argyle-btts-beide-ploegen-scoren-nee",
  "run": "B",
  "run_date": "2026-10-20",
  "kickoff": "2026-10-20T18:45:00.000Z",
  "competition": "English League One (ENG)",
  "home": "Stevenage",
  "away": "Plymouth Argyle",
  "market": "BTTS",
  "selection": "Beide ploegen scoren — nee",
  "odds": 2.22,
  "odds_source": "The Odds API (Pinnacle)",
  "odds_captured_at": "2026-10-20T05:12:00+02:00",
  "implied_prob": 0.4505,
  "my_prob": 0.5343,
  "edge_pp": 8.39,
  "data_tier": "FULL",
  "confidence": "Medium",
  "prob_sources": [
   "Fotmob team-xG English League One (ENG) — gewogen over vorig en lopend seizoen (§4 blend_seasons); doelverwachting 1.299 thuis / 1.063 uit",
   "Fotmob thuis/uit-splits English League One (ENG) (tweede methode, §1d)",
   "Fotmob wedstrijdcontext: opstelling, uitvallers met marktwaarde, vorm en rustdagen"
  ],
  "shortlisted": true,
  "result": "pending",
  "notes": "Gepubliceerd op rangorde (§5b): plek 1 van 3 over 23 doorgerekende wedstrijden. BET — en haalt ook de lat van 8.0 pp. selection_score 4.483. Ruwe kans 0.5305, ruwe edge 8.0 pp; xG-methode 6.69 pp, splitsmethode 13.27 pp, zwakste stand van het (shrink, rho)-grid 3.85 pp. shrink staat sinds 19 sep op 1.00 (§6e)."
 },
 {
  "id": "2026-10-20-english-league-one-eng-afc-wimbledon-mansfield-town-over-under-under-2-75",
  "run": "B",
  "run_date": "2026-10-20",
  "kickoff": "2026-10-20T18:45:00.000Z",
  "competition": "English League One (ENG)",
  "home": "AFC Wimbledon",
  "away": "Mansfield Town",
  "market": "Over/Under",
  "selection": "Under 2.75",
  "odds": 1.83,
  "odds_source": "The Odds API (Pinnacle)",
  "odds_captured_at": "2026-10-20T05:12:00+02:00",
  "implied_prob": 0.5464,
  "my_prob": 0.6175,
  "edge_pp": 7.1,
  "data_tier": "FULL",
  "confidence": "Medium",
  "prob_sources": [
   "Fotmob team-xG English League One (ENG) — gewogen over vorig en lopend seizoen (§4 blend_seasons); doelverwachting 1.049 thuis / 1.507 uit",
   "Fotmob thuis/uit-splits English League One (ENG) (tweede methode, §1d)",
   "Fotmob wedstrijdcontext: opstelling, uitvallers met marktwaarde, vorm en rustdagen"
  ],
  "shortlisted": true,
  "result": "pending",
  "notes": "Gepubliceerd op rangorde (§5b): plek 2 van 3 over 23 doorgerekende wedstrijden. BET op rangorde — onder de lat van 8.0 pp (§5b). selection_score 4.384. Ruwe kans 0.6122, ruwe edge 6.57 pp; xG-methode 4.22 pp, splitsmethode 15.97 pp, zwakste stand van het (shrink, rho)-grid 2.68 pp. shrink staat sinds 19 sep op 1.00 (§6e)."
 },
 {
  "id": "2026-10-20-english-league-one-eng-blackpool-milton-keynes-dons-over-under-over-2-5",
  "run": "B",
  "run_date": "2026-10-20",
  "kickoff": "2026-10-20T18:45:00.000Z",
  "competition": "English League One (ENG)",
  "home": "Blackpool",
  "away": "Milton Keynes Dons",
  "market": "Over/Under",
  "selection": "Over 2.5",
  "odds": 1.65,
  "odds_source": "The Odds API (Unibet (SE))",
  "odds_captured_at": "2026-10-20T05:12:00+02:00",
  "implied_prob": 0.6061,
  "my_prob": 0.6822,
  "edge_pp": 7.61,
  "data_tier": "LIGHT",
  "confidence": "Low",
  "prob_sources": [
   "Fotmob team-xG English League One (ENG) — gewogen over vorig en lopend seizoen (§4 blend_seasons); doelverwachting 1.630 thuis / 1.807 uit",
   "Fotmob thuis/uit-splits English League One (ENG) (tweede methode, §1d)",
   "Fotmob wedstrijdcontext: opstelling, uitvallers met marktwaarde, vorm en rustdagen"
  ],
  "shortlisted": true,
  "result": "pending",
  "notes": "Gepubliceerd op rangorde (§5b): plek 3 van 3 over 23 doorgerekende wedstrijden. BET op rangorde — onder de lat van 16.0 pp (§5b). selection_score 2.596. Ruwe kans 0.6761, ruwe edge 7.0 pp; xG-methode 6.14 pp, splitsmethode 10.48 pp, zwakste stand van het (shrink, rho)-grid 2.34 pp. shrink staat sinds 19 sep op 1.00 (§6e)."
 }
]