[
 {
  "id": "2026-09-27-uefa-nations-league-a-serbia-netherlands-asian-handicap-asian-handicap-1-25-serbia",
  "run": "C",
  "run_date": "2026-09-27",
  "kickoff": "2026-09-27T16:00:00.000Z",
  "competition": "UEFA Nations League A (id 9806)",
  "home": "Serbia",
  "away": "Netherlands",
  "market": "Asian Handicap",
  "selection": "Asian Handicap +1.25 — Serbia",
  "odds": 2.07,
  "odds_source": "The Odds API (beste prijs, netto); Pinnacle",
  "odds_captured_at": "2026-09-27T05:25:00+02:00",
  "implied_prob": 0.4831,
  "my_prob": 0.6685,
  "edge_pp": 18.54,
  "data_tier": "LIGHT",
  "confidence": "Low",
  "prob_sources": [
   "scripts/national.py — landenrating (6784 interlands, gefit 20 sep 2026)",
   "scripts/squadform.py — selectiewaarde (tweede methode, 0.30)",
   "scripts/squadform.injuries — poort 7: Serbia mist 0.9% selectiewaarde, Netherlands mist 5.0%"
  ],
  "shortlisted": true,
  "result": "pending",
  "settled_at": null,
  "settled_score": null,
  "notes": "Gepubliceerd op rangorde (§5b): plek 1 van 4 kwalificerende selecties over 13 doorgerekende duels (LIGHT), MAX_SHORTLIST=5 (zondag) niet bereikt — de drempel van 16.0 pp werkt hier dus als label, niet als veto. selection_score 6.196 (ruw 5.826). Landenrating +16.48 pp, selectiewaarde +20.42 pp — beide boven de marktkans, dus poort 5 (tweede methode) is gemeten en open. Ruwe kans 0.6597, ruwe edge +17.66 pp; zwakste stand (shrink, rho)-grid (methode 1, landenrating) +16.35 pp. Poort 7 (context, via squadform.injuries): gemeten (poort7_bron=squadform): 0.9% vs 5.0% - geen materieel nadeel; rust niet meetbaar op interlands Poort 8 (underdog): underdog-kant onder de ondergrens — de markt geeft deze ploeg 12.4% tegen 68.4% voor de tegenstander, onder de 35% waar poort 8 (§1) dichtging; poort 8 is per 2026-09-25 vervallen (keuze van de gebruiker, 18 sep 2026) en houdt hem niet meer tegen poort8_zou_hebben_geblokkeerd: JA — deze selectie stond op de underdog-kant onder UNDERDOG_FLOOR (0.35) en zou vóór 25 sep 2026 zijn tegengehouden. De poort is op 25 sep 2026 vervallen (sides.LAPSES_ON), dus hij is toch gepubliceerd. Zie run-c.md/§1e: dit is de meting die sinds 25 sep loopt. Afrekenen op de stand na 90 minuten (§6d), nooit op verlenging/strafschoppen."
 },
 {
  "id": "2026-09-27-uefa-nations-league-a-denmark-wales-asian-handicap-asian-handicap-1-25-wales",
  "run": "C",
  "run_date": "2026-09-27",
  "kickoff": "2026-09-27T16:00:00.000Z",
  "competition": "UEFA Nations League A (id 9806)",
  "home": "Denmark",
  "away": "Wales",
  "market": "Asian Handicap",
  "selection": "Asian Handicap +1.25 — Wales",
  "odds": 1.85,
  "odds_source": "The Odds API (beste prijs, netto); Pinnacle",
  "odds_captured_at": "2026-09-27T05:25:00+02:00",
  "implied_prob": 0.5405,
  "my_prob": 0.6018,
  "edge_pp": 6.13,
  "data_tier": "LIGHT",
  "confidence": "Low",
  "prob_sources": [
   "scripts/national.py — landenrating (6784 interlands, gefit 20 sep 2026)",
   "scripts/squadform.py — selectiewaarde (tweede methode, 0.30)",
   "scripts/squadform.injuries — poort 7: Denmark mist 3.5% selectiewaarde, Wales mist 12.2%"
  ],
  "shortlisted": true,
  "result": "pending",
  "settled_at": null,
  "settled_score": null,
  "notes": "Gepubliceerd op rangorde (§5b): plek 3 van 4 kwalificerende selecties over 13 doorgerekende duels (LIGHT), MAX_SHORTLIST=5 (zondag) niet bereikt — de drempel van 16.0 pp werkt hier dus als label, niet als veto. selection_score 1.843 (ruw 1.600). Landenrating +3.03 pp, selectiewaarde +10.87 pp — beide boven de marktkans, dus poort 5 (tweede methode) is gemeten en open. Ruwe kans 0.5944, ruwe edge +5.38 pp; zwakste stand (shrink, rho)-grid (methode 1, landenrating) +2.92 pp. Poort 7 (context, via squadform.injuries): gemeten (poort7_bron=squadform): 12.2% vs 3.5% - geen materieel nadeel; rust niet meetbaar op interlands Poort 8 (underdog): underdog-kant onder de ondergrens — de markt geeft deze ploeg 13.7% tegen 65.5% voor de tegenstander, onder de 35% waar poort 8 (§1) dichtging; poort 8 is per 2026-09-25 vervallen (keuze van de gebruiker, 18 sep 2026) en houdt hem niet meer tegen poort8_zou_hebben_geblokkeerd: JA — deze selectie stond op de underdog-kant onder UNDERDOG_FLOOR (0.35) en zou vóór 25 sep 2026 zijn tegengehouden. De poort is op 25 sep 2026 vervallen (sides.LAPSES_ON), dus hij is toch gepubliceerd. Zie run-c.md/§1e: dit is de meting die sinds 25 sep loopt. Afrekenen op de stand na 90 minuten (§6d), nooit op verlenging/strafschoppen."
 },
 {
  "id": "2026-09-27-uefa-nations-league-d-gibraltar-andorra-draw-no-bet-draw-no-bet-0-gibraltar",
  "run": "C",
  "run_date": "2026-09-27",
  "kickoff": "2026-09-27T16:00:00.000Z",
  "competition": "UEFA Nations League D (id 9809)",
  "home": "Gibraltar",
  "away": "Andorra",
  "market": "Draw No Bet",
  "selection": "Draw No Bet +0 — Gibraltar",
  "odds": 2.43,
  "odds_source": "The Odds API (beste prijs, netto); 1xBet",
  "odds_captured_at": "2026-09-27T05:25:00+02:00",
  "implied_prob": 0.4115,
  "my_prob": 0.4928,
  "edge_pp": 8.13,
  "data_tier": "LIGHT",
  "confidence": "Low",
  "prob_sources": [
   "scripts/national.py — landenrating (6784 interlands, gefit 20 sep 2026)",
   "scripts/squadform.py — selectiewaarde (tweede methode, 0.30)",
   "scripts/squadform.injuries — poort 7: Gibraltar mist 0.0% selectiewaarde, Andorra mist 0.0%"
  ],
  "shortlisted": true,
  "result": "pending",
  "settled_at": null,
  "settled_score": null,
  "notes": "Gepubliceerd op rangorde (§5b): plek 2 van 4 kwalificerende selecties over 13 doorgerekende duels (LIGHT), MAX_SHORTLIST=5 (zondag) niet bereikt — de drempel van 16.0 pp werkt hier dus als label, niet als veto. selection_score 2.004 (ruw 1.875). Landenrating +3.25 pp, selectiewaarde +18.03 pp — beide boven de marktkans, dus poort 5 (tweede methode) is gemeten en open. Ruwe kans 0.4883, ruwe edge +7.68 pp; zwakste stand (shrink, rho)-grid (methode 1, landenrating) +3.13 pp. Poort 7 (context, via squadform.injuries): gemeten (poort7_bron=squadform): 0.0% vs 0.0% - geen materieel nadeel; rust niet meetbaar op interlands Poort 8 (underdog): underdog-kant onder de ondergrens — de markt geeft deze ploeg 26.3% tegen 39.8% voor de tegenstander, onder de 35% waar poort 8 (§1) dichtging; poort 8 is per 2026-09-25 vervallen (keuze van de gebruiker, 18 sep 2026) en houdt hem niet meer tegen poort8_zou_hebben_geblokkeerd: JA — deze selectie stond op de underdog-kant onder UNDERDOG_FLOOR (0.35) en zou vóór 25 sep 2026 zijn tegengehouden. De poort is op 25 sep 2026 vervallen (sides.LAPSES_ON), dus hij is toch gepubliceerd. Zie run-c.md/§1e: dit is de meting die sinds 25 sep loopt. Afrekenen op de stand na 90 minuten (§6d), nooit op verlenging/strafschoppen."
 },
 {
  "id": "2026-09-27-arabian-gulf-cup-bahrain-uae-1x2-1-bahrain-wint",
  "run": "C",
  "run_date": "2026-09-27",
  "kickoff": "2026-09-27T18:00:00.000Z",
  "competition": "Arabian Gulf Cup (id 329)",
  "home": "Bahrain",
  "away": "UAE",
  "market": "1X2",
  "selection": "1 (Bahrain wint)",
  "odds": 5.33,
  "odds_source": "BetExplorer marktgemiddelde (9 boeken)",
  "odds_captured_at": "2026-09-27T05:25:00+02:00",
  "implied_prob": 0.1876,
  "my_prob": 0.2819,
  "edge_pp": 9.43,
  "data_tier": "LIGHT",
  "confidence": "Low",
  "prob_sources": [
   "scripts/national.py — landenrating (6784 interlands, gefit 20 sep 2026)",
   "scripts/squadform.injuries — poort 7: Bahrain mist 0.0% selectiewaarde, UAE mist 0.0%"
  ],
  "shortlisted": true,
  "result": "pending",
  "settled_at": null,
  "settled_score": null,
  "notes": "Gepubliceerd op rangorde (§5b): plek 4 van 4 kwalificerende selecties over 13 doorgerekende duels (LIGHT), MAX_SHORTLIST=5 (zondag) niet bereikt — de drempel van 16.0 pp werkt hier dus als label, niet als veto. selection_score 1.329 (ruw 1.361). Poort 5 (tweede methode) kon niet gemeten worden — selectie te dun bij minstens één ploeg; gerekend met de landenrating alleen. Ruwe kans 0.2836, ruwe edge +9.60 pp; zwakste stand (shrink, rho)-grid (methode 1, landenrating) +8.95 pp. Poort 7 (context, via squadform.injuries): gemeten (poort7_bron=squadform): 0.0% vs 0.0% - geen materieel nadeel; rust niet meetbaar op interlands Poort 8 (underdog): underdog-kant onder de ondergrens — de markt geeft deze ploeg 17.1% tegen 58.2% voor de tegenstander, onder de 35% waar poort 8 (§1) dichtging; poort 8 is per 2026-09-25 vervallen (keuze van de gebruiker, 18 sep 2026) en houdt hem niet meer tegen poort8_zou_hebben_geblokkeerd: JA — deze selectie stond op de underdog-kant onder UNDERDOG_FLOOR (0.35) en zou vóór 25 sep 2026 zijn tegengehouden. De poort is op 25 sep 2026 vervallen (sides.LAPSES_ON), dus hij is toch gepubliceerd. Zie run-c.md/§1e: dit is de meting die sinds 25 sep loopt. Afrekenen op de stand na 90 minuten (§6d), nooit op verlenging/strafschoppen."
 }
]