[
 {
  "id": "2026-10-06-mls-usa-chicago-fire-fc-vancouver-whitecaps-over-under-under-3-5",
  "run": "B",
  "run_date": "2026-10-06",
  "kickoff": "2026-10-07T00:30:00.000Z",
  "competition": "MLS (USA)",
  "home": "Chicago Fire FC",
  "away": "Vancouver Whitecaps",
  "market": "Over/Under",
  "selection": "Under 3.5",
  "odds": 1.7644,
  "odds_source": "The Odds API (Matchbook, beurs: 1.78 bruto / 1.7644 na 2% commissie)",
  "odds_captured_at": "2026-10-06T05:12:00+02:00",
  "implied_prob": 0.5668,
  "my_prob": 0.6182,
  "edge_pp": 5.15,
  "data_tier": "FULL",
  "confidence": "Medium",
  "prob_sources": [
   "Fotmob team-xG MLS (USA) — gewogen over vorig en lopend seizoen (§4 blend_seasons); doelverwachting 1.357 thuis / 1.856 uit",
   "Fotmob thuis/uit-splits MLS (USA) (tweede methode, §1d)",
   "Fotmob wedstrijdcontext: opstelling, uitvallers met marktwaarde, vorm en rustdagen"
  ],
  "shortlisted": true,
  "result": "pending",
  "notes": "Gepubliceerd op rangorde (§5b): plek 1 van 1 over 1 doorgerekende wedstrijden. BET op rangorde — onder de lat van 8.0 pp (§5b). selection_score 3.184. Ruwe kans 0.6223, ruwe edge 5.55 pp; xG-methode 3.27 pp, splitsmethode 14.66 pp, zwakste stand van het (shrink, rho)-grid 2.62 pp. shrink staat sinds 19 sep op 1.00 (§6e)."
 }
]