[
 {
  "id": "2026-10-11-austrian-bundesliga-aut-altach-wolfsberger-ac-over-under-under-3",
  "run": "B",
  "run_date": "2026-10-11",
  "kickoff": "2026-10-11T12:30:00.000Z",
  "competition": "Austrian Bundesliga (AUT)",
  "home": "Altach",
  "away": "Wolfsberger AC",
  "market": "Over/Under",
  "selection": "Under 3",
  "odds": 1.88,
  "odds_source": "The Odds API (Pinnacle)",
  "odds_captured_at": "2026-10-11T05:20:00+02:00",
  "implied_prob": 0.5319,
  "my_prob": 0.6456,
  "edge_pp": 11.37,
  "data_tier": "FULL",
  "confidence": "Medium",
  "prob_sources": [
   "Fotmob team-xG Austrian Bundesliga (AUT) — gewogen over vorig en lopend seizoen (§4 blend_seasons); doelverwachting 1.624 thuis / 0.919 uit",
   "Fotmob thuis/uit-splits Austrian Bundesliga (AUT) (tweede methode, §1d)",
   "Fotmob wedstrijdcontext: opstelling, uitvallers met marktwaarde, vorm en rustdagen"
  ],
  "shortlisted": true,
  "result": "pending",
  "notes": "Gepubliceerd op rangorde (§5b): plek 1 van 5 over 42 doorgerekende wedstrijden. BET — en haalt ook de lat van 8.0 pp. selection_score 7.34. Ruwe kans 0.6432, ruwe edge 11.13 pp; xG-methode 11.57 pp, splitsmethode 9.37 pp, zwakste stand van het (shrink, rho)-grid 9.5 pp. shrink staat sinds 19 sep op 1.00 (§6e)."
 },
 {
  "id": "2026-10-11-swiss-super-league-sui-st-gallen-lausanne-over-under-under-3-5",
  "run": "B",
  "run_date": "2026-10-11",
  "kickoff": "2026-10-11T14:30:00.000Z",
  "competition": "Swiss Super League (SUI)",
  "home": "St. Gallen",
  "away": "Lausanne",
  "market": "Over/Under",
  "selection": "Under 3.5",
  "odds": 1.8526000000000002,
  "odds_source": "The Odds API (Matchbook, beurs: 1.87 bruto / 1.8526 na 2% commissie)",
  "odds_captured_at": "2026-10-11T05:20:00+02:00",
  "implied_prob": 0.5398,
  "my_prob": 0.6521,
  "edge_pp": 11.23,
  "data_tier": "FULL",
  "confidence": "Medium",
  "prob_sources": [
   "Fotmob team-xG Swiss Super League (SUI) — gewogen over vorig en lopend seizoen (§4 blend_seasons); doelverwachting 1.962 thuis / 1.059 uit",
   "Fotmob thuis/uit-splits Swiss Super League (SUI) (tweede methode, §1d)",
   "Fotmob wedstrijdcontext: opstelling, uitvallers met marktwaarde, vorm en rustdagen"
  ],
  "shortlisted": true,
  "result": "pending",
  "notes": "Gepubliceerd op rangorde (§5b): plek 2 van 5 over 42 doorgerekende wedstrijden. BET — en haalt ook de lat van 8.0 pp. selection_score 7.323. Ruwe kans 0.6496, ruwe edge 10.98 pp; xG-methode 10.28 pp, splitsmethode 13.8 pp, zwakste stand van het (shrink, rho)-grid 7.47 pp. shrink staat sinds 19 sep op 1.00 (§6e)."
 },
 {
  "id": "2026-10-11-eliteserien-nor-lillestrm-molde-over-under-under-3-5",
  "run": "B",
  "run_date": "2026-10-11",
  "kickoff": "2026-10-11T17:15:00.000Z",
  "competition": "Eliteserien (NOR)",
  "home": "Lillestrøm",
  "away": "Molde",
  "market": "Over/Under",
  "selection": "Under 3.5",
  "odds": 1.9114,
  "odds_source": "The Odds API (Matchbook, beurs: 1.93 bruto / 1.9114 na 2% commissie)",
  "odds_captured_at": "2026-10-11T05:20:00+02:00",
  "implied_prob": 0.5232,
  "my_prob": 0.6998,
  "edge_pp": 17.66,
  "data_tier": "LIGHT",
  "confidence": "Low",
  "prob_sources": [
   "Fotmob team-xG Eliteserien (NOR) — gewogen over vorig en lopend seizoen (§4 blend_seasons); doelverwachting 1.588 thuis / 1.347 uit",
   "Fotmob thuis/uit-splits Eliteserien (NOR) (tweede methode, §1d)",
   "Fotmob wedstrijdcontext: opstelling, uitvallers met marktwaarde, vorm en rustdagen"
  ],
  "shortlisted": true,
  "result": "pending",
  "notes": "Gepubliceerd op rangorde (§5b): plek 3 van 5 over 42 doorgerekende wedstrijden. BET — en haalt ook de lat van 16.0 pp. selection_score 6.179. Ruwe kans 0.6971, ruwe edge 17.39 pp; xG-methode 13.88 pp, splitsmethode 31.47 pp, zwakste stand van het (shrink, rho)-grid 12.26 pp. shrink staat sinds 19 sep op 1.00 (§6e)."
 },
 {
  "id": "2026-10-11-austrian-bundesliga-aut-lask-rapid-wien-over-under-under-3-5",
  "run": "B",
  "run_date": "2026-10-11",
  "kickoff": "2026-10-11T15:00:00.000Z",
  "competition": "Austrian Bundesliga (AUT)",
  "home": "LASK",
  "away": "Rapid Wien",
  "market": "Over/Under",
  "selection": "Under 3.5",
  "odds": 1.7644,
  "odds_source": "The Odds API (Matchbook, beurs: 1.78 bruto / 1.7644 na 2% commissie)",
  "odds_captured_at": "2026-10-11T05:20:00+02:00",
  "implied_prob": 0.5668,
  "my_prob": 0.6579,
  "edge_pp": 9.12,
  "data_tier": "FULL",
  "confidence": "Medium",
  "prob_sources": [
   "Fotmob team-xG Austrian Bundesliga (AUT) — gewogen over vorig en lopend seizoen (§4 blend_seasons); doelverwachting 1.756 thuis / 1.265 uit",
   "Fotmob thuis/uit-splits Austrian Bundesliga (AUT) (tweede methode, §1d)",
   "Fotmob wedstrijdcontext: opstelling, uitvallers met marktwaarde, vorm en rustdagen"
  ],
  "shortlisted": true,
  "result": "pending",
  "notes": "Gepubliceerd op rangorde (§5b): plek 4 van 5 over 42 doorgerekende wedstrijden. BET — en haalt ook de lat van 8.0 pp. selection_score 6.0. Ruwe kans 0.6555, ruwe edge 8.87 pp; xG-methode 7.58 pp, splitsmethode 14.05 pp, zwakste stand van het (shrink, rho)-grid 7.58 pp. shrink staat sinds 19 sep op 1.00 (§6e)."
 },
 {
  "id": "2026-10-11-serie-a-bra-palmeiras-corinthians-btts-beide-ploegen-scoren-nee",
  "run": "B",
  "run_date": "2026-10-11",
  "kickoff": "2026-10-11T20:30:00.000Z",
  "competition": "Série A (BRA)",
  "home": "Palmeiras",
  "away": "Corinthians",
  "market": "BTTS",
  "selection": "Beide ploegen scoren — nee",
  "odds": 1.8036,
  "odds_source": "The Odds API (Matchbook, beurs: 1.82 bruto / 1.8036 na 2% commissie)",
  "odds_captured_at": "2026-10-11T05:20:00+02:00",
  "implied_prob": 0.5544,
  "my_prob": 0.6339,
  "edge_pp": 7.94,
  "data_tier": "FULL",
  "confidence": "Medium",
  "prob_sources": [
   "Fotmob team-xG Série A (BRA) — gewogen over vorig en lopend seizoen (§4 blend_seasons); doelverwachting 1.310 thuis / 0.720 uit",
   "Fotmob thuis/uit-splits Série A (BRA) (tweede methode, §1d)",
   "Fotmob wedstrijdcontext: opstelling, uitvallers met marktwaarde, vorm en rustdagen"
  ],
  "shortlisted": true,
  "result": "pending",
  "notes": "Gepubliceerd op rangorde (§5b): plek 5 van 5 over 42 doorgerekende wedstrijden. BET op rangorde — onder de lat van 8.0 pp (§5b). selection_score 5.033. Ruwe kans 0.6315, ruwe edge 7.71 pp; xG-methode 6.47 pp, splitsmethode 12.68 pp, zwakste stand van het (shrink, rho)-grid 1.62 pp. shrink staat sinds 19 sep op 1.00 (§6e)."
 }
]