[
 {
  "id": "2026-09-27-segunda-division-esp-eibar-las-palmas-over-under-under-2-5",
  "run": "B",
  "run_date": "2026-09-27",
  "kickoff": "2026-09-27T16:30:00.000Z",
  "competition": "Segunda División (ESP)",
  "home": "Eibar",
  "away": "Las Palmas",
  "market": "Over/Under",
  "selection": "Under 2.5",
  "odds": 1.96,
  "odds_source": "The Odds API (1xBet)",
  "odds_captured_at": "2026-09-27T05:05:00+02:00",
  "implied_prob": 0.5102,
  "my_prob": 0.6955,
  "edge_pp": 18.53,
  "data_tier": "FULL",
  "confidence": "Medium",
  "prob_sources": [
   "Fotmob team-xG Segunda División (ESP) — gewogen over vorig en lopend seizoen (§4 blend_seasons); doelverwachting 1.119 thuis / 0.775 uit",
   "Fotmob thuis/uit-splits Segunda División (ESP) (tweede methode, §1d)",
   "Fotmob wedstrijdcontext: opstelling, uitvallers met marktwaarde, vorm en rustdagen"
  ],
  "shortlisted": true,
  "result": "pending",
  "notes": "Gepubliceerd op rangorde (§5b): plek 1 van 4 over 7 doorgerekende wedstrijden. BET — en haalt ook de lat van 8.0 pp. selection_score 12.888. Ruwe kans 0.6863, ruwe edge 17.61 pp; xG-methode 19.5 pp, splitsmethode 10.08 pp, zwakste stand van het (shrink, rho)-grid 14.23 pp. shrink staat sinds 19 sep op 1.00 (§6e)."
 },
 {
  "id": "2026-09-27-segunda-division-esp-real-oviedo-sporting-gijon-over-under-under-2-5",
  "run": "B",
  "run_date": "2026-09-27",
  "kickoff": "2026-09-27T19:00:00.000Z",
  "competition": "Segunda División (ESP)",
  "home": "Real Oviedo",
  "away": "Sporting Gijón",
  "market": "Over/Under",
  "selection": "Under 2.5",
  "odds": 1.61,
  "odds_source": "The Odds API (1xBet)",
  "odds_captured_at": "2026-09-27T05:05:00+02:00",
  "implied_prob": 0.6211,
  "my_prob": 0.7671,
  "edge_pp": 14.6,
  "data_tier": "LIGHT",
  "confidence": "Low",
  "prob_sources": [
   "Fotmob team-xG Segunda División (ESP) — gewogen over vorig en lopend seizoen (§4 blend_seasons); doelverwachting 0.913 thuis / 0.885 uit",
   "Fotmob thuis/uit-splits Segunda División (ESP) (tweede methode, §1d)",
   "Fotmob wedstrijdcontext: opstelling, uitvallers met marktwaarde, vorm en rustdagen"
  ],
  "shortlisted": true,
  "result": "pending",
  "notes": "Gepubliceerd op rangorde (§5b): plek 2 van 4 over 7 doorgerekende wedstrijden. BET op rangorde — onder de lat van 16.0 pp (§5b). selection_score 5.6. Ruwe kans 0.7574, ruwe edge 13.63 pp; xG-methode 10.99 pp, splitsmethode 24.15 pp, zwakste stand van het (shrink, rho)-grid 4.98 pp. shrink staat sinds 19 sep op 1.00 (§6e)."
 },
 {
  "id": "2026-09-27-segunda-division-esp-mallorca-almeria-1x2-1-mallorca-wint",
  "run": "B",
  "run_date": "2026-09-27",
  "kickoff": "2026-09-27T14:15:00.000Z",
  "competition": "Segunda División (ESP)",
  "home": "Mallorca",
  "away": "Almería",
  "market": "1X2",
  "selection": "1 (Mallorca wint)",
  "odds": 2.12,
  "odds_source": "The Odds API — beste prijs Pinnacle",
  "odds_captured_at": "2026-09-27T05:05:00+02:00",
  "implied_prob": 0.4717,
  "my_prob": 0.631,
  "edge_pp": 15.93,
  "data_tier": "LIGHT",
  "confidence": "Low",
  "prob_sources": [
   "Fotmob team-xG Segunda División (ESP) — gewogen over vorig en lopend seizoen (§4 blend_seasons); doelverwachting 2.016 thuis / 1.017 uit",
   "Fotmob thuis/uit-splits Segunda División (ESP) (tweede methode, §1d)",
   "Fotmob wedstrijdcontext: opstelling, uitvallers met marktwaarde, vorm en rustdagen"
  ],
  "shortlisted": true,
  "result": "pending",
  "notes": "Gepubliceerd op rangorde (§5b): plek 3 van 4 over 7 doorgerekende wedstrijden. BET op rangorde — onder de lat van 16.0 pp (§5b). selection_score 5.026. Ruwe kans 0.623, ruwe edge 15.13 pp; xG-methode 12.84 pp, splitsmethode 24.26 pp, zwakste stand van het (shrink, rho)-grid 7.6 pp. shrink staat sinds 19 sep op 1.00 (§6e)."
 },
 {
  "id": "2026-09-27-segunda-division-esp-real-valladolid-cordoba-over-under-under-2-5",
  "run": "B",
  "run_date": "2026-09-27",
  "kickoff": "2026-09-27T12:00:00.000Z",
  "competition": "Segunda División (ESP)",
  "home": "Real Valladolid",
  "away": "Córdoba",
  "market": "Over/Under",
  "selection": "Under 2.5",
  "odds": 2.1368,
  "odds_source": "The Odds API (Matchbook, beurs: 2.16 bruto / 2.1368 na 2% commissie)",
  "odds_captured_at": "2026-09-27T05:05:00+02:00",
  "implied_prob": 0.468,
  "my_prob": 0.5344,
  "edge_pp": 6.65,
  "data_tier": "FULL",
  "confidence": "Medium",
  "prob_sources": [
   "Fotmob team-xG Segunda División (ESP) — gewogen over vorig en lopend seizoen (§4 blend_seasons); doelverwachting 1.409 thuis / 1.214 uit",
   "Fotmob thuis/uit-splits Segunda División (ESP) (tweede methode, §1d)",
   "Fotmob wedstrijdcontext: opstelling, uitvallers met marktwaarde, vorm en rustdagen"
  ],
  "shortlisted": true,
  "result": "pending",
  "notes": "Gepubliceerd op rangorde (§5b): plek 4 van 4 over 7 doorgerekende wedstrijden. BET op rangorde — onder de lat van 8.0 pp (§5b). selection_score 3.554. Ruwe kans 0.5287, ruwe edge 6.08 pp; xG-methode 4.47 pp, splitsmethode 12.49 pp, zwakste stand van het (shrink, rho)-grid 4.41 pp. shrink staat sinds 19 sep op 1.00 (§6e)."
 }
]