[
 {
  "id": "2026-10-28-league-cup-eng-afc-bournemouth-aston-villa-1x2-1-bournemouth-wint",
  "run": "A",
  "run_date": "2026-10-28",
  "kickoff": "2026-10-28T19:45:00.000Z",
  "competition": "League Cup (ENG)",
  "home": "AFC Bournemouth",
  "away": "Aston Villa",
  "market": "1X2",
  "selection": "1 (Bournemouth wint)",
  "odds": 2.32,
  "odds_source": "The Odds API — beste prijs 1xBet",
  "odds_captured_at": "2026-10-28T03:35:00+01:00",
  "implied_prob": 0.431,
  "my_prob": 0.585,
  "edge_pp": 15.39,
  "data_tier": "FULL",
  "confidence": "Medium",
  "prob_sources": [
   "Fotmob team-xG van 2025/2026 geblend met het lopende seizoen (§4 blend_seasons, k=8); doelverwachting 2.180 thuis / 1.078 uit",
   "Fotmob thuis/uit-doelpuntensplits van 2025/2026 (tweede methode, §1d multiplicatief en op het competitiegemiddelde genormaliseerd); doelverwachting 1.584 / 1.211",
   "Fotmob wedstrijdcontext: voorspelde/laatste opstelling, uitvallers met marktwaarde, vorm over vijf duels, rustdagen en stadioncontrole",
   "seizoensweging per ploeg: {\"AFC Bournemouth\": {\"eenheid\": \"xG\", \"duels_dit_seizoen\": 8, \"gewicht_dit_seizoen\": 0.5, \"xg_per_duel\": {\"vorig\": 1.626, \"dit\": 1.812, \"gewogen\": 1.719}, \"xga_per_duel\": {\"vorig\": 1.497, \"dit\": 1.163, \"gewogen\": 1.33}}, \"Aston Villa\": {\"eenheid\": \"xG\", \"duels_dit_seizoen\": 8, \"gewicht_dit_seizoen\": 0.5, \"xg_per_duel\": {\"vorig\": 1.271, \"dit\": 1.137, \"gewogen\": 1.204}, \"xga_per_duel\": {\"vorig\": 1.421, \"dit\": 1.6, \"gewogen\": 1.511}}}"
  ],
  "shortlisted": true,
  "result": "pending",
  "notes": "Gepubliceerd op rangorde (§5b): plek 1 van 3 over 33 doorgerekende wedstrijden. BET — en haalt ook de lat van 8.0 pp. selection_score 9.003. Ruwe kans 0.5867, ruwe edge 15.57 pp; xG-methode 18.88 pp, splitsmethode 2.32 pp, zwakste stand van het (shrink, rho)-grid 13.9 pp. shrink staat sinds 19 sep op 1.00 (§6e). "
 },
 {
  "id": "2026-10-28-dfb-pokal-ger-hannover-96-kaiserslautern-asian-handicap-hannover-96-0-25",
  "run": "A",
  "run_date": "2026-10-28",
  "kickoff": "2026-10-28T19:45:00.000Z",
  "competition": "DFB Pokal (GER)",
  "home": "Hannover 96",
  "away": "Kaiserslautern",
  "market": "Asian Handicap",
  "selection": "Hannover 96 -0.25",
  "odds": 2.06,
  "odds_source": "The Odds API (Pinnacle)",
  "odds_captured_at": "2026-10-28T03:35:00+01:00",
  "implied_prob": 0.4854,
  "my_prob": 0.5969,
  "edge_pp": 11.14,
  "data_tier": "FULL",
  "confidence": "Medium",
  "prob_sources": [
   "Fotmob team-xG van 2025/2026 geblend met het lopende seizoen (§4 blend_seasons, k=8); doelverwachting 2.064 thuis / 1.275 uit",
   "Fotmob thuis/uit-doelpuntensplits van 2025/2026 (tweede methode, §1d multiplicatief en op het competitiegemiddelde genormaliseerd); doelverwachting 1.788 / 1.159",
   "Fotmob wedstrijdcontext: voorspelde/laatste opstelling, uitvallers met marktwaarde, vorm over vijf duels, rustdagen en stadioncontrole",
   "seizoensweging per ploeg: {\"Hannover 96\": {\"eenheid\": \"xG\", \"duels_dit_seizoen\": 9, \"gewicht_dit_seizoen\": 0.529, \"xg_per_duel\": {\"vorig\": 2.044, \"dit\": 1.7, \"gewogen\": 1.862}, \"xga_per_duel\": {\"vorig\": 1.279, \"dit\": 1.589, \"gewogen\": 1.443}}, \"Kaiserslautern\": {\"eenheid\": \"xG\", \"duels_dit_seizoen\": 9, \"gewicht_dit_seizoen\": 0.529, \"xg_per_duel\": {\"vorig\": 1.565, \"dit\": 1.467, \"gewogen\": 1.513}, \"xga_per_duel\": {\"vorig\": 1.691, \"dit\": 1.356, \"gewogen\": 1.513}}}"
  ],
  "shortlisted": true,
  "result": "pending",
  "notes": "Gepubliceerd op rangorde (§5b): plek 2 van 3 over 33 doorgerekende wedstrijden. BET — en haalt ook de lat van 8.0 pp. selection_score 6.649. Ruwe kans 0.5987, ruwe edge 11.32 pp; xG-methode 11.93 pp, splitsmethode 8.91 pp, zwakste stand van het (shrink, rho)-grid 9.4 pp. shrink staat sinds 19 sep op 1.00 (§6e). "
 },
 {
  "id": "2026-10-28-scottish-premiership-sco-st-mirren-hibernian-over-under-under-3",
  "run": "A",
  "run_date": "2026-10-28",
  "kickoff": "2026-10-28T19:45:00.000Z",
  "competition": "Scottish Premiership (SCO)",
  "home": "St. Mirren",
  "away": "Hibernian",
  "market": "Over/Under",
  "selection": "Under 3",
  "odds": 1.71,
  "odds_source": "The Odds API (Coolbet)",
  "odds_captured_at": "2026-10-28T03:35:00+01:00",
  "implied_prob": 0.5848,
  "my_prob": 0.6491,
  "edge_pp": 6.43,
  "data_tier": "FULL",
  "confidence": "Medium",
  "prob_sources": [
   "Fotmob team-xG van 2025/2026 geblend met het lopende seizoen (§4 blend_seasons, k=8); doelverwachting 1.376 thuis / 1.391 uit",
   "Fotmob thuis/uit-doelpuntensplits van 2025/2026 (tweede methode, §1d multiplicatief en op het competitiegemiddelde genormaliseerd); doelverwachting 0.596 / 1.191",
   "Fotmob wedstrijdcontext: voorspelde/laatste opstelling, uitvallers met marktwaarde, vorm over vijf duels, rustdagen en stadioncontrole",
   "seizoensweging per ploeg: {\"St. Mirren\": {\"eenheid\": \"xG\", \"duels_dit_seizoen\": 10, \"gewicht_dit_seizoen\": 0.556, \"xg_per_duel\": {\"vorig\": 1.082, \"dit\": 1.5, \"gewogen\": 1.314}, \"xga_per_duel\": {\"vorig\": 1.263, \"dit\": 1.99, \"gewogen\": 1.667}}, \"Hibernian\": {\"eenheid\": \"xG\", \"duels_dit_seizoen\": 10, \"gewicht_dit_seizoen\": 0.556, \"xg_per_duel\": {\"vorig\": 1.479, \"dit\": 1.52, \"gewogen\": 1.502}, \"xga_per_duel\": {\"vorig\": 1.189, \"dit\": 1.53, \"gewogen\": 1.379}}}"
  ],
  "shortlisted": true,
  "result": "pending",
  "notes": "Gepubliceerd op rangorde (§5b): plek 3 van 3 over 33 doorgerekende wedstrijden. BET op rangorde — onder de lat van 8.0 pp (§5b). selection_score 4.174. Ruwe kans 0.6511, ruwe edge 6.63 pp; xG-methode 2.23 pp, splitsmethode 24.25 pp, zwakste stand van het (shrink, rho)-grid 0.38 pp. shrink staat sinds 19 sep op 1.00 (§6e). ONDER-KANT: §6g meet dat P(Under) bij élk duel ongeveer twee procentpunt te hoog staat door een vormfout in score_grid (gemeten vandaag over 1686 doorgerekende duels: P(Under 2.5) voorspeld 42,4% tegen werkelijk 40,3%, en massa verschoven van 2 doelpunten naar 4 en 5), en dat de gespeelde Under-kant daar bovenop een selectie-effect heeft van +0,587 doelpunt per duel over 96 gevallen (z = +3,48), terwijl de Over-kant op -0,296 staat (z = -1,25 over 60 gevallen). Dit duel staat op FULL, dus poort 9 (§1h) kan hier bijten; of hij dat werkelijk doet hangt af van de band waarin de edge valt — hij bindt ALLEEN tussen 8,0 en 10,0 pp, en laat een Under daaronder met opzet door omdat `edge` daar de bindende poort hoort te zijn. Dat is de rem die er is; de oorzaak — keuze (a) van 11 oktober, de vormfout zelf repareren — staat nog open. Trek dus ongeveer twee procentpunt van de genoemde kans af voordat je haar leest. bet_beide = FALSE: deze selectie haalt haar lat op GEEN van beide schalen en is op rangorde gepubliceerd, niet op een gevonden voordeel (§5b). "
 }
]