[
 {
  "id": "2026-10-12-ekstraklasa-pol-gks-katowice-wieczysta-krakow-1x2-1-gks-katowice-wint",
  "run": "A",
  "run_date": "2026-10-12",
  "kickoff": "2026-10-12T18:30:00.000Z",
  "competition": "Ekstraklasa (POL)",
  "home": "GKS Katowice",
  "away": "Wieczysta Kraków",
  "market": "1X2",
  "selection": "1 (GKS Katowice wint)",
  "odds": 2.12,
  "odds_source": "The Odds API — beste prijs Coolbet",
  "odds_captured_at": "2026-10-12T04:40:00+02:00",
  "implied_prob": 0.4717,
  "my_prob": 0.6329,
  "edge_pp": 16.12,
  "data_tier": "LIGHT",
  "confidence": "Low",
  "prob_sources": [
   "Fotmob team-xG Ekstraklasa (POL) — gewogen over vorig en lopend seizoen (§4 blend_seasons); doelverwachting 2.391 thuis / 1.316 uit",
   "Fotmob thuis/uit-splits Ekstraklasa (POL) (tweede methode, §1d)",
   "Fotmob wedstrijdcontext: opstelling, uitvallers met marktwaarde, vorm en rustdagen"
  ],
  "shortlisted": true,
  "result": "pending",
  "notes": "Gepubliceerd op rangorde (§5b): plek 1 van 3 over 9 doorgerekende wedstrijden. BET — en haalt ook de lat van 16.0 pp. selection_score 5.101. Ruwe kans 0.6251, ruwe edge 15.34 pp; xG-methode 13.68 pp, splitsmethode 21.97 pp, zwakste stand van het (shrink, rho)-grid 9.79 pp. shrink staat sinds 19 sep op 1.00 (§6e). LET OP — bet_beide = FALSE: deze selectie haalt de drempel van 8,0 pp ALLEEN op de herijkte schaal; ruw blijft hij eronder. §5a beslist publicatie op de herijkte my_prob, dus dit is geregeld gedrag, maar het label van toplist.build ('haalt ook de lat') zegt dat niet."
 },
 {
  "id": "2026-10-12-ekstraklasa-pol-radomiak-radom-motor-lublin-1x2-1-radomiak-radom-wint",
  "run": "A",
  "run_date": "2026-10-12",
  "kickoff": "2026-10-12T16:00:00.000Z",
  "competition": "Ekstraklasa (POL)",
  "home": "Radomiak Radom",
  "away": "Motor Lublin",
  "market": "1X2",
  "selection": "1 (Radomiak Radom wint)",
  "odds": 2.54,
  "odds_source": "The Odds API — beste prijs BetOnline.ag",
  "odds_captured_at": "2026-10-12T04:40:00+02:00",
  "implied_prob": 0.3937,
  "my_prob": 0.49,
  "edge_pp": 9.63,
  "data_tier": "FULL",
  "confidence": "Medium",
  "prob_sources": [
   "Fotmob team-xG Ekstraklasa (POL) — gewogen over vorig en lopend seizoen (§4 blend_seasons); doelverwachting 1.763 thuis / 1.442 uit",
   "Fotmob thuis/uit-splits Ekstraklasa (POL) (tweede methode, §1d)",
   "Fotmob wedstrijdcontext: opstelling, uitvallers met marktwaarde, vorm en rustdagen"
  ],
  "shortlisted": true,
  "result": "pending",
  "notes": "Gepubliceerd op rangorde (§5b): plek 2 van 3 over 9 doorgerekende wedstrijden. BET — en haalt ook de lat van 8.0 pp. selection_score 4.719. Ruwe kans 0.4857, ruwe edge 9.2 pp; xG-methode 5.39 pp, splitsmethode 24.42 pp, zwakste stand van het (shrink, rho)-grid 4.88 pp. shrink staat sinds 19 sep op 1.00 (§6e)."
 },
 {
  "id": "2026-10-12-serie-a-ita-atalanta-venezia-over-under-under-3-5",
  "run": "A",
  "run_date": "2026-10-12",
  "kickoff": "2026-10-12T16:30:00.000Z",
  "competition": "Serie A (ITA)",
  "home": "Atalanta",
  "away": "Venezia",
  "market": "Over/Under",
  "selection": "Under 3.5",
  "odds": 1.6958,
  "odds_source": "The Odds API (Matchbook, beurs: 1.71 bruto / 1.6958 na 2% commissie)",
  "odds_captured_at": "2026-10-12T04:40:00+02:00",
  "implied_prob": 0.5897,
  "my_prob": 0.702,
  "edge_pp": 11.24,
  "data_tier": "LIGHT",
  "confidence": "Low",
  "prob_sources": [
   "Fotmob team-xG Serie A (ITA) — gewogen over vorig en lopend seizoen (§4 blend_seasons); doelverwachting 1.592 thuis / 1.288 uit",
   "Fotmob thuis/uit-splits Serie A (ITA) (tweede methode, §1d)",
   "Fotmob wedstrijdcontext: opstelling, uitvallers met marktwaarde, vorm en rustdagen"
  ],
  "shortlisted": true,
  "result": "pending",
  "notes": "Gepubliceerd op rangorde (§5b): plek 3 van 3 over 9 doorgerekende wedstrijden. BET op rangorde — onder de lat van 16.0 pp (§5b). selection_score 3.945. Ruwe kans 0.693, ruwe edge 10.34 pp; xG-methode 8.45 pp, splitsmethode 17.88 pp, zwakste stand van het (shrink, rho)-grid 8.45 pp. shrink staat sinds 19 sep op 1.00 (§6e). LET OP — bet_beide = FALSE: deze selectie haalt de drempel van 8,0 pp ALLEEN op de herijkte schaal; ruw blijft hij eronder. §5a beslist publicatie op de herijkte my_prob, dus dit is geregeld gedrag, maar het label van toplist.build ('haalt ook de lat') zegt dat niet."
 }
]