[
 {
  "id": "2026-09-19-eliteserien-nor-kristiansund-rosenborg-1x2-1-kristiansund-bk-wint",
  "run": "B",
  "run_date": "2026-09-19",
  "kickoff": "2026-09-19T14:00:00.000Z",
  "competition": "Eliteserien (NOR)",
  "home": "Kristiansund",
  "away": "Rosenborg",
  "market": "1X2",
  "selection": "1 (Kristiansund BK wint)",
  "odds": 5.606,
  "odds_source": "The Odds API — beste prijs Betfair, beurs: 5.7 bruto / 5.606 na 2% commissie",
  "odds_captured_at": "2026-09-19T11:05:00+02:00",
  "implied_prob": 0.1784,
  "my_prob": 0.2544,
  "edge_pp": 7.6,
  "data_tier": "FULL",
  "confidence": "Medium",
  "prob_sources": [
   "Fotmob team-xG Eliteserien (NOR) — gewogen over vorig en lopend seizoen (§4 blend_seasons); doelverwachting 1.628 thuis / 2.009 uit",
   "Fotmob thuis/uit-splits Eliteserien (NOR) (tweede methode, §1d)",
   "Fotmob wedstrijdcontext: opstelling, uitvallers met marktwaarde, vorm en rustdagen"
  ],
  "shortlisted": true,
  "result": "pending",
  "notes": "Gepubliceerd op rangorde (§5b): plek 1 van 3 over 57 doorgerekende wedstrijden. BET op rangorde — onder de lat van 8.0 pp (§5b). selection_score 1.933. Ruwe kans 0.3243, ruwe edge 14.59 pp; xG-methode 13.36 pp, splitsmethode 19.5 pp, zwakste stand van het (shrink, rho)-grid None pp. shrink staat sinds 19 sep op 1.00 (§6e)."
 },
 {
  "id": "2026-09-19-swiss-super-league-sui-young-boys-servette-1x2-2-servette-wint",
  "run": "B",
  "run_date": "2026-09-19",
  "kickoff": "2026-09-19T16:00:00.000Z",
  "competition": "Swiss Super League (SUI)",
  "home": "Young Boys",
  "away": "Servette",
  "market": "1X2",
  "selection": "2 (Servette wint)",
  "odds": 5.018,
  "odds_source": "The Odds API — beste prijs Betfair, beurs: 5.1 bruto / 5.018 na 2% commissie",
  "odds_captured_at": "2026-09-19T11:05:00+02:00",
  "implied_prob": 0.1993,
  "my_prob": 0.2312,
  "edge_pp": 3.19,
  "data_tier": "FULL",
  "confidence": "Medium",
  "prob_sources": [
   "Fotmob team-xG Swiss Super League (SUI) — gewogen over vorig en lopend seizoen (§4 blend_seasons); doelverwachting 2.192 thuis / 1.766 uit",
   "Fotmob thuis/uit-splits Swiss Super League (SUI) (tweede methode, §1d)",
   "Fotmob wedstrijdcontext: opstelling, uitvallers met marktwaarde, vorm en rustdagen"
  ],
  "shortlisted": true,
  "result": "pending",
  "notes": "Gepubliceerd op rangorde (§5b): plek 2 van 3 over 57 doorgerekende wedstrijden. BET op rangorde — onder de lat van 8.0 pp (§5b). selection_score 0.738. Ruwe kans 0.292, ruwe edge 9.27 pp; xG-methode 11.29 pp, splitsmethode 1.17 pp, zwakste stand van het (shrink, rho)-grid None pp. shrink staat sinds 19 sep op 1.00 (§6e)."
 },
 {
  "id": "2026-09-19-keuken-kampioen-divisie-ned-vitesse-jong-psv-1x2-2-jong-psv-wint",
  "run": "B",
  "run_date": "2026-09-19",
  "kickoff": "2026-09-19T14:30:00.000Z",
  "competition": "Keuken Kampioen Divisie (NED)",
  "home": "Vitesse",
  "away": "Jong PSV",
  "market": "1X2",
  "selection": "2 (Jong PSV wint)",
  "odds": 4.61,
  "odds_source": "BetExplorer (18 boeken, marktgemiddelde; bookmaker niet herleidbaar)",
  "odds_captured_at": "2026-09-19T11:05:00+02:00",
  "implied_prob": 0.2169,
  "my_prob": 0.226,
  "edge_pp": 0.9,
  "data_tier": "LIGHT",
  "confidence": "Low",
  "prob_sources": [
   "Fotmob team-xG Keuken Kampioen Divisie (NED) — gewogen over vorig en lopend seizoen (§4 blend_seasons); doelverwachting 2.059 thuis / 1.465 uit",
   "Fotmob thuis/uit-splits Keuken Kampioen Divisie (NED) (tweede methode, §1d)",
   "Fotmob wedstrijdcontext: opstelling, uitvallers met marktwaarde, vorm en rustdagen"
  ],
  "shortlisted": true,
  "result": "pending",
  "notes": "Gepubliceerd op rangorde (§5b): plek 3 van 3 over 57 doorgerekende wedstrijden. BET op rangorde — onder de lat van 16.0 pp (§5b). selection_score 0.102. Ruwe kans 0.2847, ruwe edge 6.77 pp; xG-methode 5.22 pp, splitsmethode 12.99 pp, zwakste stand van het (shrink, rho)-grid None pp. shrink staat sinds 19 sep op 1.00 (§6e)."
 }
]