[
 {
  "id": "2026-10-23-2-bundesliga-ger-darmstadt-st-pauli-over-under-under-2-75",
  "run": "B",
  "run_date": "2026-10-23",
  "kickoff": "2026-10-23T16:30:00.000Z",
  "competition": "2. Bundesliga (GER)",
  "home": "Darmstadt",
  "away": "St. Pauli",
  "market": "Over/Under",
  "selection": "Under 2.75",
  "odds": 1.97,
  "odds_source": "The Odds API (Pinnacle)",
  "odds_captured_at": "2026-10-23T05:18:00+02:00",
  "implied_prob": 0.5076,
  "my_prob": 0.6053,
  "edge_pp": 9.77,
  "data_tier": "LIGHT",
  "confidence": "Low",
  "prob_sources": [
   "Fotmob team-xG 2. Bundesliga (GER) — gewogen over vorig en lopend seizoen (§4 blend_seasons); doelverwachting 1.160 thuis / 1.306 uit",
   "Fotmob thuis/uit-splits 2. Bundesliga (GER) (tweede methode, §1d)",
   "Fotmob wedstrijdcontext: opstelling, uitvallers met marktwaarde, vorm en rustdagen"
  ],
  "shortlisted": true,
  "result": "pending",
  "notes": "Gepubliceerd op rangorde (§5b): plek 1 van 3 over 19 doorgerekende wedstrijden. BET op rangorde — onder de lat van 16.0 pp (§5b). selection_score 2.957. Ruwe kans 0.6052, ruwe edge 9.76 pp; xG-methode 9.88 pp, splitsmethode 9.27 pp, zwakste stand van het (shrink, rho)-grid 5.27 pp. shrink staat sinds 19 sep op 1.00 (§6e)."
 },
 {
  "id": "2026-10-23-segunda-division-esp-granada-real-valladolid-over-under-over-2-25",
  "run": "B",
  "run_date": "2026-10-23",
  "kickoff": "2026-10-23T18:30:00.000Z",
  "competition": "Segunda División (ESP)",
  "home": "Granada",
  "away": "Real Valladolid",
  "market": "Over/Under",
  "selection": "Over 2.25",
  "odds": 1.86,
  "odds_source": "The Odds API (Pinnacle)",
  "odds_captured_at": "2026-10-23T05:18:00+02:00",
  "implied_prob": 0.5376,
  "my_prob": 0.583,
  "edge_pp": 4.54,
  "data_tier": "FULL",
  "confidence": "Medium",
  "prob_sources": [
   "Fotmob team-xG Segunda División (ESP) — gewogen over vorig en lopend seizoen (§4 blend_seasons); doelverwachting 1.479 thuis / 1.256 uit",
   "Fotmob thuis/uit-splits Segunda División (ESP) (tweede methode, §1d)",
   "Fotmob wedstrijdcontext: opstelling, uitvallers met marktwaarde, vorm en rustdagen"
  ],
  "shortlisted": true,
  "result": "pending",
  "notes": "Gepubliceerd op rangorde (§5b): plek 2 van 3 over 19 doorgerekende wedstrijden. BET op rangorde — onder de lat van 8.0 pp (§5b). selection_score 2.647. Ruwe kans 0.5829, ruwe edge 4.52 pp; xG-methode 4.41 pp, splitsmethode 4.99 pp, zwakste stand van het (shrink, rho)-grid 4.25 pp. shrink staat sinds 19 sep op 1.00 (§6e)."
 },
 {
  "id": "2026-10-23-keuken-kampioen-divisie-ned-top-oss-jong-ajax-1x2-1-top-oss-wint",
  "run": "B",
  "run_date": "2026-10-23",
  "kickoff": "2026-10-23T18:00:00.000Z",
  "competition": "Keuken Kampioen Divisie (NED)",
  "home": "TOP Oss",
  "away": "Jong Ajax",
  "market": "1X2",
  "selection": "1 (TOP Oss wint)",
  "odds": 2.03,
  "odds_source": "BetExplorer (16 boeken, marktgemiddelde; bookmaker niet herleidbaar)",
  "odds_captured_at": "2026-10-23T05:18:00+02:00",
  "implied_prob": 0.4926,
  "my_prob": 0.5598,
  "edge_pp": 6.72,
  "data_tier": "LIGHT",
  "confidence": "Low",
  "prob_sources": [
   "Fotmob team-xG Keuken Kampioen Divisie (NED) — gewogen over vorig en lopend seizoen (§4 blend_seasons); doelverwachting 2.055 thuis / 1.185 uit",
   "Fotmob thuis/uit-splits Keuken Kampioen Divisie (NED) (tweede methode, §1d)",
   "Fotmob wedstrijdcontext: opstelling, uitvallers met marktwaarde, vorm en rustdagen"
  ],
  "shortlisted": true,
  "result": "pending",
  "notes": "Gepubliceerd op rangorde (§5b): plek 3 van 3 over 19 doorgerekende wedstrijden. BET op rangorde — onder de lat van 16.0 pp (§5b). selection_score 1.881. Ruwe kans 0.5597, ruwe edge 6.71 pp; xG-methode 7.69 pp, splitsmethode 2.8 pp, zwakste stand van het (shrink, rho)-grid 4.32 pp. shrink staat sinds 19 sep op 1.00 (§6e)."
 }
]